<?xml version="1.0" encoding="UTF-8"?>
<!ELEMENT wagenbestand (wagen*)>
<!ELEMENT wagen (hersteller, modell, baujahr, erstzulassung, km, neuwagen?, antriebsart, motor, unfall*, url?, karosserieform)>
<!ATTLIST wagen
    WagenID ID #REQUIRED
>
<!ELEMENT km (#PCDATA)>
<!ELEMENT ps (#PCDATA)>
<!ELEMENT url (#PCDATA)>
<!ELEMENT tank (#PCDATA)>
<!ELEMENT day (#PCDATA)>
<!ELEMENT month (#PCDATA)>
<!ELEMENT year (#PCDATA)>
<!ELEMENT motor (verbrennung | elektro)>
<!ELEMENT modell (#PCDATA)>
<!ELEMENT unfall (date, beschreibung)>
<!ELEMENT baujahr (#PCDATA)>
<!ELEMENT neuwagen EMPTY>
<!ELEMENT hersteller (#PCDATA)>
<!ELEMENT antriebsart EMPTY>
<!ATTLIST antriebsart
    typ (Front | Heck | Allrad) #REQUIRED
>
<!ELEMENT verbrennung (ps, tank)>
<!ATTLIST verbrennung
    typ (Benzin | Diesel) #REQUIRED
>
<!ELEMENT elektro (ps, akkukapazitaet)>
<!ATTLIST elektro
    typ CDATA #FIXED "Elektro"
>
<!ELEMENT akkukapazitaet (#PCDATA)>
<!ELEMENT beschreibung (#PCDATA)>
<!ELEMENT erstzulassung (date | none)>
<!ELEMENT date (day, month, year)>
<!ELEMENT none EMPTY>
<!ELEMENT karosserieform EMPTY>
<!ATTLIST karosserieform
    typ (Limousine | Coupe | Kombi | Cabriolet | sonstige) #REQUIRED
>
